{
  "$schema": "../schemas/learning.schema.json",
  "$comment": "The learning systems (docs/content-data.md, COURSE-PACKS.md \"Learning systems\"): real-app tasks the scripts hand off with {\"appTask\": id}, the chapters' learning objectives (quoted from each chapter's Learning Objectives) and what covers them, the reflection before each Seal (the Key Takeaways). The quests' own done lines say what you learned, so `learned` is empty: the Logbook adds whether the app work is confirmed.",
  "labels": {
    "kicker": "Do this in the Copilot app",
    "checklist": "App checklist",
    "tool": "the Copilot app"
  },
  "appTasks": [
    {
      "id": "A0.1",
      "chapter": "00-setup",
      "quest": "Q0.2",
      "title": "Install the app and sign in",
      "steps": [
        "Download and install the GitHub Copilot app for your computer.",
        "Open it and select **Sign in to GitHub**, then sign in with your GitHub account.",
        "At **Connect your repositories**, leave every repository unselected and select **Continue**."
      ],
      "why": "Every chapter starts in the app: it’s where you give Copilot’s agents their orders.",
      "source": {
        "chapter": "00-setup",
        "anchor": "installation",
        "hash": "bf12cef33675"
      },
      "link": {
        "label": "Download the Copilot app",
        "url": "https://github.com/features/ai/github-app"
      },
      "seen": {
        "prompt": "Which view does the app open once you’re in?",
        "options": [
          {
            "id": "new",
            "text": "**New**"
          },
          {
            "id": "prs",
            "text": "**Pull requests**"
          },
          {
            "id": "settings",
            "text": "**Settings**"
          }
        ],
        "answer": "new",
        "explain": "The app opens the **New** view. If it shows a short tip about a new feature, you can close it."
      }
    },
    {
      "id": "A0.2",
      "chapter": "00-setup",
      "quest": "Q0.3",
      "title": "Fork the course repository",
      "steps": [
        "Open the course repository’s fork page on GitHub.com and create your fork.",
        "Your fork is your own copy of the repository, under your GitHub account."
      ],
      "why": "Your practice work lands in your own copy, not the course’s.",
      "source": {
        "chapter": "00-setup",
        "anchor": "connect-to-your-repository",
        "hash": "fda261a1fa97"
      },
      "link": {
        "label": "Fork the course repository",
        "url": "https://github.com/github/copilot-app-for-beginners/fork"
      },
      "check": {
        "kind": "repoExists"
      }
    },
    {
      "id": "A0.3",
      "chapter": "00-setup",
      "quest": "Q0.3",
      "title": "Add your fork under Sessions",
      "steps": [
        "In the app, select **+** next to **Sessions**, then **Add GitHub repository**.",
        "Type `copilot-app-for-beginners` and select your fork: the result that starts with your GitHub username."
      ],
      "why": "The app downloads a local copy (clones it), so its sessions can work in your repository.",
      "source": {
        "chapter": "00-setup",
        "anchor": "connect-to-your-repository",
        "hash": "fda261a1fa97"
      },
      "seen": {
        "prompt": "Where does your fork show up once it’s added?",
        "options": [
          {
            "id": "sidebar",
            "text": "In the sidebar, under **Sessions**"
          },
          {
            "id": "settings",
            "text": "In **Settings**"
          },
          {
            "id": "prs",
            "text": "In the **Pull requests** view"
          }
        ],
        "answer": "sidebar",
        "explain": "The app clones your fork and adds the project to the sidebar, under **Sessions**."
      }
    },
    {
      "id": "A0.4",
      "chapter": "00-setup",
      "quest": "Q0.4",
      "title": "Start your setup session",
      "steps": [
        "Point to `copilot-app-for-beginners` in the sidebar and select the **+** that appears next to it.",
        "In the workspace selector below the prompt box, choose **Current checkout**.",
        "Send the short prompt from your Logbook page: name the top-level folders, and don’t change any files."
      ],
      "why": "This one-time setup session uses the clone that’s already on your machine.",
      "source": {
        "chapter": "00-setup",
        "anchor": "check-your-tools-in-terminal",
        "hash": "a098a1855e14"
      }
    },
    {
      "id": "A0.5",
      "chapter": "00-setup",
      "quest": "Q0.4",
      "title": "Check your tools in Terminal",
      "steps": [
        "Select **View** > **Toggle Review Panel**, then **Terminal** (no tab? **+**, then **Terminal**).",
        "Run `git --version`, `node -v`, `npm -v` and `gh --version`. Each should print a version number.",
        "Run `gh auth status` and check it shows the account that owns your fork."
      ],
      "why": "The setup script and later exercises use these tools, and GitHub CLI has its own sign-in.",
      "source": {
        "chapter": "00-setup",
        "anchor": "check-your-tools-in-terminal",
        "hash": "a098a1855e14"
      },
      "seen": {
        "prompt": "For `node -v`, what do you compare the first number with?",
        "options": [
          {
            "id": "lts",
            "text": "The **LTS** version on the Node.js download page"
          },
          {
            "id": "npm",
            "text": "The number `npm -v` printed"
          },
          {
            "id": "any",
            "text": "Nothing: any number is fine"
          }
        ],
        "answer": "lts",
        "explain": "Compare the first number with the **LTS** version on the Node.js download page. If yours is lower, install the LTS version."
      }
    },
    {
      "id": "A0.6",
      "chapter": "00-setup",
      "quest": "Q0.7",
      "title": "Enable workflows on your fork",
      "steps": [
        "In your browser, open your fork on GitHub.com and select the **Actions** tab.",
        "If you see **Workflows aren't being run on this forked repository**, select **I understand my workflows, go ahead and enable them**."
      ],
      "why": "New forks turn workflows off. With them on, GitHub runs the practice exercises’ automated checks.",
      "source": {
        "chapter": "00-setup",
        "anchor": "add-the-course-practice-items",
        "hash": "15d697dd1d02"
      }
    },
    {
      "id": "A0.7",
      "chapter": "00-setup",
      "quest": "Q0.7",
      "title": "Run the setup script",
      "steps": [
        "In the same **Terminal** tab, from the repository root, run `node .github/scripts/setup-training-scenarios.js --dry-run`.",
        "Check that the `Repository:` line shows your fork.",
        "Then run `node .github/scripts/setup-training-scenarios.js --yes` and wait for `Setup complete.`"
      ],
      "why": "Later chapters use the labels, issues, practice branches and pull requests it makes in your fork.",
      "source": {
        "chapter": "00-setup",
        "anchor": "add-the-course-practice-items",
        "hash": "15d697dd1d02"
      },
      "check": {
        "kind": "branchExists",
        "branch": "{practiceBranch}"
      },
      "seen": {
        "prompt": "How does the dry run end?",
        "options": [
          {
            "id": "dry",
            "text": "`Dry run complete. No changes were made.`"
          },
          {
            "id": "setup",
            "text": "`Setup complete.`"
          },
          {
            "id": "failed",
            "text": "`Setup failed`"
          }
        ],
        "answer": "dry",
        "explain": "The preview ends with `Dry run complete. No changes were made.` Only `--yes` creates the practice items, and ends with `Setup complete.`"
      }
    },
    {
      "id": "A0.8",
      "chapter": "00-setup",
      "quest": "Q0.8",
      "title": "Ask the agent about the course",
      "steps": [
        "Go back to the prompt box of your project session (not Terminal).",
        "Send the overview prompt from your Logbook page: an overview of the course repository, focused on the learning path and `samples/book-app-web`."
      ],
      "why": "Requests for the agent go in the prompt box; commands go in Terminal.",
      "source": {
        "chapter": "00-setup",
        "anchor": "learn-more-about-the-course-repository",
        "hash": "104572df79ac"
      },
      "seen": {
        "prompt": "Which folder does the summary name as the web sample for later exercises?",
        "options": [
          {
            "id": "book",
            "text": "`samples/book-app-web`"
          },
          {
            "id": "scripts",
            "text": "`.github/scripts`"
          },
          {
            "id": "root",
            "text": "The repository root"
          }
        ],
        "answer": "book",
        "explain": "The app should summarize the course structure and identify `samples/book-app-web` as the web sample used for later exercises."
      }
    },
    {
      "id": "A1.1",
      "chapter": "01-tour-the-app",
      "quest": "Q1.3",
      "title": "Ask a question in a chat",
      "steps": [
        "Select **+** next to **Sessions**, then **Chat**.",
        "Check that the project picker below the prompt box shows **Chat**.",
        "Send the prompt on your Logbook page: when to use a chat, and when a project session."
      ],
      "why": "Chats are for questions: no branch, no worktree, and no files change.",
      "source": {
        "chapter": "01-tour-the-app",
        "anchor": "chat-sessions",
        "hash": "9d8ea69782bc"
      },
      "seen": {
        "prompt": "What does the app create for a chat?",
        "options": [
          {
            "id": "none",
            "text": "No branch or worktree"
          },
          {
            "id": "worktree",
            "text": "A new worktree"